{
  "schema_version": "1.0",
  "task_id": "20260830_180538_task",
  "task_type": "causal_synthesis",
  "query": "为什么技术爆发初期底层硬件与核心设备制造商会获得暴利？",
  "summary": "证据将技术爆发的价值捕获分为三阶段：底层硬件与核心设备制造商因工程物理壁垒与产能稀缺性享有 60%-80% 的垄断毛利率和产业链绝大部分利润；其后基础设施过度投资引发回报下挫；最终价值捕获向终端平台型企业迁移。暴利的根源在于壁垒与稀缺性支撑的垄断定价能力。",
  "claims": [
    {
      "id": "claim_001",
      "text": "在技术爆发初期，底层动力供给存在极高的工程物理壁垒与产能稀缺性，这是底层硬件与核心设备制造商获得暴利的前提。",
      "epistemic_state": "supported",
      "evidence_refs": ["M01:ch5-3:0062"],
      "rationale": "证据在第一阶段直接给出'工程物理壁垒与产能稀缺性'作为暴利的原因。"
    },
    {
      "id": "claim_002",
      "text": "底层硬件与核心设备制造商享有高达 60%-80% 的垄断毛利率。",
      "epistemic_state": "supported",
      "evidence_refs": ["M01:ch5-3:0062"],
      "rationale": "证据原文直接给出该毛利率区间。"
    },
    {
      "id": "claim_003",
      "text": "底层硬件与核心设备制造商享有整个产业链绝大部分的经济利润。",
      "epistemic_state": "supported",
      "evidence_refs": ["M01:ch5-3:0062"],
      "rationale": "证据原文直接陈述。"
    },
    {
      "id": "claim_004",
      "text": "证据列举的暴利主体包括瓦特与博尔顿的蒸汽机厂、爱迪生与通用电气的发电设备部门、英特尔的 CPU、英伟达的 GPU 与台积电的 CoWoS 先进封装。",
      "epistemic_state": "supported",
      "evidence_refs": ["M01:ch5-3:0062"],
      "rationale": "证据原文逐项列举这些案例。"
    },
    {
      "id": "claim_005",
      "text": "证据描述第二阶段中铁路公司、电网公用事业、电信运营商与当前的超大规模云厂商为争夺未来通道霸权进行规模空前的融资与过度资本开支，并据此推断这种模式可能引发'暗算力（Dark Compute）'过剩与资本回报率（ROIC）下挫。",
      "epistemic_state": "inference",
      "evidence_refs": ["M01:ch5-3:0062"],
      "rationale": "历史主体（铁路/电网/电信）的过度投资及其后果为证据直接陈述；对当前云厂商'必然'引发过剩属于从历史模式向当下与未来的外推，故按推断评级并保留'可能'限定。"
    },
    {
      "id": "claim_006",
      "text": "证据描述第三阶段：当底层算力与能源因过度竞争降为极低成本的公用事业品后，价值捕获中枢漂移向直接掌控终端用户、重塑垂直行业工作流、并将 AI 深度嵌入组织微观肌理的平台型与生态型企业。",
      "epistemic_state": "supported",
      "evidence_refs": ["M01:ch5-3:0062"],
      "rationale": "证据原文直接描述第三阶段的迁移方向。"
    },
    {
      "id": "claim_007",
      "text": "可推断，第一阶段暴利的来源是工程物理壁垒与产能稀缺性共同支撑的垄断定价能力，而非单纯的技术领先。",
      "epistemic_state": "inference",
      "evidence_refs": ["M01:ch5-3:0062"],
      "rationale": "由壁垒、稀缺性、垄断毛利率三者的并列陈述综合推导。"
    },
    {
      "id": "claim_008",
      "text": "可推断，底层硬件制造商的暴利与'技术爆发初期'这一阶段相对应，其超额利润可能随产业进入基础设施过度投资与分化阶段而受到侵蚀。",
      "epistemic_state": "inference",
      "evidence_refs": ["M01:ch5-3:0062"],
      "rationale": "由'价值捕获的终局迁移'分阶段框架推导，结论表述使用'可能'。"
    }
  ],
  "tensions": [
    {
      "id": "tension_001",
      "text": "证据将铁路/电网/电信的历史模式外推到当前超大规模云厂商并断言'必然'引发算力过剩与 ROIC 下挫，但未提供云厂商当前阶段的直接数据，该因果断言的强度与证据力度不匹配。",
      "epistemic_state": "uncertain",
      "evidence_refs": ["M01:ch5-3:0062"]
    },
    {
      "id": "tension_002",
      "text": "证据既称第一阶段制造商'享有整个产业链绝大部分经济利润'，又称价值捕获'终局'向终端平台迁移，但未说明第一阶段暴利在第二、三阶段被侵蚀的具体机制与时点。",
      "epistemic_state": "inference",
      "evidence_refs": ["M01:ch5-3:0062"]
    }
  ],
  "uncertainties": [
    "60%-80% 的垄断毛利率区间未说明统计口径与时间范围。",
    "第三阶段价值捕获'不可逆'的判断缺乏反例与边界条件讨论。",
    "对当前超大规模云厂商过度资本开支的实际规模与回报影响缺乏直接证据。"
  ],
  "open_questions": [
    "底层硬件与核心设备制造商的暴利在技术成熟后以何种速度、通过何种机制下降？",
    "当前的英伟达 GPU 与台积电 CoWoS 暴利是否正处在向第二阶段迁移的临界点？"
  ],
  "additional_evidence_needed": [
    {
      "question": "是否有超大规模云厂商资本开支与 ROIC 的直接数据来验证'暗算力过剩'推断？",
      "reason": "当前关于云厂商阶段后果的表述是从历史模式外推，缺乏当期数据支撑。"
    },
    {
      "question": "是否有第一阶段制造商垄断毛利率随时间变化的实证数据？",
      "reason": "证据仅给出暴利阶段的静态毛利率区间，无法验证其时段性。"
    }
  ],
  "worker": {
    "tool": "codex-external",
    "model": null
  },
  "generated_at": "2026-08-30T23:45:17+08:00"
}