{
  "task_id": "20260830_180538_task",
  "task_type": "tension_extraction",
  "query": "价值捕获终局在底层设备与网络分发之间是否存在证据张力？",
  "summary": "围绕底层设备层与网络分发/平台层的价值捕获终局辨析证据张力：直接可验证的融资、资本开支与当前集中度事实标 supported；\"争夺未来通道霸权\"目标及\"必然引发过剩/不可逆漂移/价值迁移\"拆为 inference；第三方份额估算标 uncertain 并保留来源与限定词；最终在 tensions 中记录设备层现状与平台层终局之间的不确定张力。",
  "claims": [
    {
      "id": "claim_001",
      "epistemic_state": "supported",
      "text": "第一阶段底层设备制造商（英伟达 GPU、台积电 CoWoS 先进封装、通用电气发电设备等）凭极高工程物理壁垒享有 60%~80% 的垄断毛利率并获得产业链绝大部分经济利润。",
      "evidence_refs": [
        "M01:ch5-3:0062"
      ],
      "rationale": "证据直接陈述装备层垄断毛利率与利润位势，未改口径。"
    },
    {
      "id": "claim_002",
      "epistemic_state": "supported",
      "text": "第二阶段网络与基础设施建设者（超大规模云厂商等）进行了规模空前的债务或股权融资，并开展过度资本开支（Over-Capex）——此为直接可验证的融资与资本开支事实。",
      "evidence_refs": [
        "M01:ch5-3:0062"
      ],
      "rationale": "融资与过度资本开支为可观测行为事实，已剔除\"争夺未来通道霸权\"目标定语。"
    },
    {
      "id": "claim_003",
      "epistemic_state": "inference",
      "text": "上述大规模融资与资本开支被证据描述为\"为了争夺未来的通道霸权\"；该未来目标非已发生事实，仅能作为行为动机推断，故单列并标为 inference。",
      "evidence_refs": [
        "M01:ch5-3:0062"
      ],
      "rationale": "原文以\"为了争夺未来的通道霸权\"表述目的，属动机推断而非可观测事实。"
    },
    {
      "id": "claim_004",
      "epistemic_state": "inference",
      "text": "若过度资本开支持续，该阶段可能引发严重的\"暗光纤/暗算力\"过剩与资本回报率（ROIC）下挫；此为基于阶段模式的预测性后果而非已观测事实，原文以\"必然引发\"强调强因果。",
      "evidence_refs": [
        "M01:ch5-3:0062"
      ],
      "rationale": "过剩与 ROIC 下挫为未来后果推演，保留\"若\"条件与强因果不确定性，不标 supported。"
    },
    {
      "id": "claim_005",
      "epistemic_state": "inference",
      "text": "在底层算力与能源降为极低成本公用事业品的条件下，价值捕获中枢可能不可逆地漂移向掌控终端用户与重塑行业工作流的平台型与生态型企业（标注 [L1 因果证实]）；\"不可逆漂移\"与价值迁移为结构性推断而非直接观测事实。",
      "evidence_refs": [
        "M01:ch5-3:0062"
      ],
      "rationale": "漂移依赖算力公用事业化前提，不可逆程度无法验证，保留条件与 [L1] 归因。"
    },
    {
      "id": "claim_006",
      "epistemic_state": "supported",
      "text": "当前已观测集中度显示：AI 时代租金高度集中于三层栈顶端与瓶颈（设备与算力层），少数超大规模云厂同时掌握需求入口与资本开支，形成\"模型—算力—云\"纵向租金漏斗。",
      "evidence_refs": [
        "四次技术革命比较解剖_最终报告:ch2:o22:0028"
      ],
      "rationale": "证据直接描述当前三层栈结构与纵向租金漏斗，属集中度结构性事实。"
    },
    {
      "id": "claim_007",
      "epistemic_state": "supported",
      "text": "Nvidia 2027 财年第一季度营收达 816 亿美元、数据中心收入 752 亿美元（同比 +92%）创纪录，显示底层设备与算力层当前处于高位；此为已披露财务事实而非预测。",
      "evidence_refs": [
        "四次技术革命比较解剖_最终报告:ch2:o22:0028"
      ],
      "rationale": "816 亿/752 亿为财报实际披露数值，属已观测事实，非未来预测。"
    },
    {
      "id": "claim_008",
      "epistemic_state": "uncertain",
      "text": "第三方研究估算显示 Nvidia 占 AI 加速器收入约 80%、TSMC 占晶圆代工约 72%、SK Hynix 占 HBM 约 50%~55%，均为份额估算口径，保留\"约\"与来源（OECD 2025、BIS 2026、Stanford HAI 2026），标为 uncertain。",
      "evidence_refs": [
        "四次技术革命比较解剖_最终报告:ch2:o22:0028"
      ],
      "rationale": "均为市场份额估算而非精确可验证值，保留估算口径与来源，标 uncertain。"
    },
    {
      "id": "claim_009",
      "epistemic_state": "uncertain",
      "text": "平台流量份额方面，证据引用 OECD 2025 在线集市研究指出单一平台流量份额可达 80% 以上；该份额为估算口径，保留\"可达\"与来源，标为 uncertain。",
      "evidence_refs": [
        "四次技术革命比较解剖_最终报告:ch2:o22:0028"
      ],
      "rationale": "份额\"可达 80% 以上\"为第三方估算，保留\"可达\"与来源，标 uncertain。"
    },
    {
      "id": "claim_010",
      "epistemic_state": "supported",
      "text": "四轮价值链租金归属存在阶段性模式：铁路时代归轨道/路权所有者、电气时代归电气设备商、平台时代归流量入口、AI 时代归三层栈顶端与瓶颈；此为已归纳的历史与当下归属结构。",
      "evidence_refs": [
        "四次技术革命比较解剖_最终报告:ch2:o22:0028"
      ],
      "rationale": "证据直接陈述四轮归属模式，为已归纳的结构事实。"
    }
  ],
  "tensions": [
    {
      "id": "tension_001",
      "epistemic_state": "uncertain",
      "text": "底层设备/算力层与网络分发/平台层之间的价值捕获终局存在张力：一端证据显示当前集中度与垄断利润仍高度集中于设备与瓶颈层（Nvidia、台积电、SK Hynix、超大规模云厂的纵向租金漏斗）；另一端推断价值捕获中枢将\"不可逆地\"漂移向掌控终端用户与组织的平台型/生态型企业。终局是否已发生、迁移是否不可逆，缺乏直接观测证据，标 uncertain。",
      "evidence_refs": [
        "M01:ch5-3:0062",
        "四次技术革命比较解剖_最终报告:ch2:o22:0028"
      ],
      "rationale": "设备层现状与平台层终局推断并存，迁移实现与不可逆性无观测支撑，标 uncertain。"
    },
    {
      "id": "tension_002",
      "epistemic_state": "uncertain",
      "text": "证据以\"第一阶段设备层暴利\"与\"第三阶段平台层终局\"分阶段描述价值归属，但两阶段在当下的并行或取代关系未获观测印证；过度资本开支能否将现状导入平台终局缺乏直接因果证据。",
      "evidence_refs": [
        "M01:ch5-3:0062",
        "四次技术革命比较解剖_最终报告:ch2:o22:0028"
      ],
      "rationale": "阶段转换关系与因果链条未在证据中观测确认，标 uncertain。"
    }
  ],
  "uncertainties": [
    "第三方份额（Nvidia 约 80%、TSMC 约 72%、SK Hynix 约 50%~55%、平台流量份额可达 80% 以上）分属 OECD 2025、BIS 2026、Stanford HAI 2026 的不同时点口径，未归一化。",
    "\"必然引发暗光纤/暗算力过剩与 ROIC 下挫\"依赖持续过度资本开支这一阶段条件，属预测性后果，无法验证。",
    "\"价值捕获终局不可逆漂移向平台层\"依赖算力公用事业化前置条件，是否不可逆无从验证。",
    "设备层现状与平台层终局之间的迁移是否已实际发生，证据仅给出结构描述而无数值对照。"
  ],
  "open_questions": [
    "设备层（Nvidia/台积电/SK Hynix）当前高位收入是否已在向平台层让渡，证据无增量对照。",
    "底层设备与网络分发两层的价值捕获是否相互取代而非长期并存？",
    "\"不可逆\"在什么时间尺度与机制下成立，证据未给出。"
  ],
  "additional_evidence_needed": [
    {
      "question": "设备层与网络分发/平台层若干期经济利润或利润占比对照。",
      "reason": "判定价值捕获终局是否已实际迁移，现仅有单点收入与集中度而无迁移后的利润分布。"
    },
    {
      "question": "对\"过度资本开支—暗算力过剩—ROIC 下挫\"的量化观测（利用率、ROIC 序列）。",
      "reason": "验证预测性后果是否已发生。"
    },
    {
      "question": "关于终局不可逆漂移的长期观测或机制证据。",
      "reason": "不可逆主张仅有 [L1 因果证实] 标签而无独立观测支撑。"
    }
  ],
  "worker": {
    "tool": "codex-external",
    "provider": "external",
    "model": null
  },
  "generated_at": "2026-08-31T00:53:41+08:00",
  "schema_version": "1.0"
}