{
  "schema_version": "1.0",
  "task_id": "20260830_180538_pfas",
  "task_type": "tension_extraction",
  "query": "两相浸没式液冷的物理优雅与 PFAS 环保死结之间存在哪些张力？",
  "summary": "证据显示存在双重张力：两相浸没式液冷在物理传热学上被描述为“极为优雅”，但其冷却介质与 PFAS 禁令正面冲突，被称遭遇“现代工业史上最毁灭性的环保规制死结”；浸没式液冷对不导电绝缘介电液体的功能性依赖与 PFAS 物质的环保合规约束在材料层面形成冲突。",
  "claims": [
    {
      "id": "claim_001",
      "text": "浸没式液冷将整台服务器主板、CPU、GPU、内存及供电模块完全浸泡在不导电的绝缘介电液体（Dielectric Fluid）中。",
      "epistemic_state": "supported",
      "evidence_refs": ["M07:ch4-1:0039"]
    },
    {
      "id": "claim_002",
      "text": "两相浸没式液冷在物理传热学上极为优雅。",
      "epistemic_state": "supported",
      "evidence_refs": ["M07:ch4-2:0042"]
    },
    {
      "id": "claim_003",
      "text": "两相浸没式液冷遭遇全氟和多氟烷基物质（PFAS）禁令这一环保规制约束，被证据描述为“现代工业史上最毁灭性的环保规制死结”。",
      "epistemic_state": "supported",
      "evidence_refs": ["M07:ch4-2:0042"]
    },
    {
      "id": "claim_004",
      "text": "两相结合推断：浸没式液冷依赖不导电绝缘介电液体实现浸泡散热（证据一），而两相浸没式液冷正面遭遇 PFAS 禁令（证据二），表明其采用的介电液体与受禁的 PFAS 类物质之间可能存在直接材料关联，这是物理传热优势与环保合规冲突的可能根源。",
      "epistemic_state": "inference",
      "evidence_refs": ["M07:ch4-1:0039", "M07:ch4-2:0042"],
      "rationale": "证据分别陈述介质类型与 PFAS 禁令，物质对应关系为跨块推断，使用“可能/表明”限定。"
    }
  ],
  "tensions": [
    {
      "id": "tension_001",
      "text": "物理性能与环保合规之间的核心张力：两相浸没式液冷“在物理传热学上极为优雅”（性能优势）与 PFAS 禁令“现代工业史上最毁灭性的环保规制死结”（合规约束）并存于同一技术路径——性能优雅与规制死结的对照。",
      "evidence_refs": ["M07:ch4-2:0042"]
    },
    {
      "id": "tension_002",
      "text": "功能性需求与可持续性需求之间的材料张力：浸没式液冷必须依靠不导电的绝缘介电液体实现整机浸泡（功能性前提），而 PFAS 类物质恰恰面临环保禁令（可持续性约束）——功能依赖与合规限制在同一物质维度上冲突。",
      "evidence_refs": ["M07:ch4-1:0039", "M07:ch4-2:0042"]
    }
  ],
  "uncertainties": [
    "两相浸没式液冷所用介电液体是否必然属于 PFAS 受禁物质，证据未逐字说明（两处证据分别陈述，关联为推断）。",
    "PFAS 禁令的具体范围、时间表与豁免条款未给出。",
    "单相浸没式液冷是否同样受 PFAS 约束，证据内容未涉及。"
  ],
  "open_questions": [
    "是否存在 PFAS 禁令豁免范围内、可替代的绝缘介电液体？",
    "PFAS 禁令落地后两相浸没式液冷技术路径的存续方式是什么？"
  ],
  "additional_evidence_needed": [
    {
      "question": "两相浸没式液冷所用介电液体的化学成分及其 PFAS 归类的直接证据是什么？",
      "reason": "证据仅分别陈述“绝缘介电液体”与“PFAS 禁令”，未直接说明两者的物质对应关系。"
    },
    {
      "question": "PFAS 禁令的具体范围、时间表与豁免机制是什么？",
      "reason": "证据未给出法规细节，无法评估技术路径受影响的程度。"
    }
  ],
  "worker": {
    "tool": "codex-external",
    "model": "claude-sonnet-4"
  },
  "generated_at": "2026-08-30T23:10:23+08:00"
}