{
  "schema_version": "1.0",
  "task_id": "20260830_180538_pfas",
  "task_type": "causal_synthesis",
  "query": "为什么 PFAS 禁令会冲击两相浸没式液冷的供应链？",
  "summary": "证据仅定性称两相浸没式液冷遭遇 PFAS 禁令这一“环保规制死结”，并将“3M 退出氟化液市场”与“全球供应链冲击”置于同一章节标题下；具体传导机制（受限物质、禁令条款、供应链细节）证据不足，仅能作推断并声明证据缺口。",
  "claims": [
    {
      "id": "claim_001",
      "text": "两相浸没式液冷在物理传热学上被报告称为“极为优雅”，但被报告定性为遭遇“现代工业史上最毁灭性的环保规制死结”——全氟和多氟烷基物质（PFAS）禁令。",
      "epistemic_state": "supported",
      "evidence_refs": ["M07:ch4-2:0042"],
      "rationale": "证据直接陈述该定性"
    },
    {
      "id": "claim_002",
      "text": "报告章节标题将“PFAS 禁令下 3M 退出氟化液市场”与“全球供应链冲击”并列；据此可推断 PFAS 禁令可能通过削减氟化液供给对两相浸没式液冷供应链造成冲击，但正文证据未提供传导机制的具体细节（如受限物质清单、禁令条款、替代供应商情况）。",
      "epistemic_state": "inference",
      "evidence_refs": ["M07:ch4-2:0042"],
      "rationale": "标题层面关联属推断，使用可能限定并声明正文证据缺口"
    }
  ],
  "tensions": [],
  "uncertainties": [
    "PFAS 禁令的具体规制范围、时间表与受限物质无证据",
    "3M 退出氟化液市场与禁令的因果关联仅见于章节标题，正文无细节",
    "两相浸没式液冷所用介质液的具体成分及其与 PFAS 的关联未说明"
  ],
  "open_questions": [
    "两相浸没式液冷介质液中受 PFAS 禁令规制的具体组分是什么？",
    "禁令实施后单相液冷或替代介电液方案的过渡可能性？"
  ],
  "additional_evidence_needed": [
    {
      "question": "PFAS 禁令与两相浸没式液冷供应链的具体关联（受限物质清单、禁令条款、涉及规模）",
      "reason": "现有证据仅为“死结”的定性陈述，无任何供应链细节"
    },
    {
      "question": "3M 退出氟化液市场的细节与替代供应商情况",
      "reason": "仅章节标题提及，无正文证据"
    }
  ],
  "worker": {
    "tool": "codex-external",
    "model": "claude-sonnet-4"
  },
  "generated_at": "2026-08-30T23:15:00+08:00"
}