{
  "schema_version": "1.0",
  "task_id": "20260830_180537_ai",
  "task_type": "causal_synthesis",
  "query": "AI 算力扩张推升液冷需求的因果机制是什么？",
  "summary": "AI 算力扩张推升液冷需求的核心因果机制表现为物理功耗演进、换热热力学极限与机架功率密度攀升的三重驱动：\n1. 功耗攀升突破风冷极限：随着 GPU 单芯片功耗（TDP）从 A100 (400W)、H100 (700W) 提升至 B200 (1,000W)，单机架功率密度迅速超越风冷在 40–50 kW/机架处的物理散热极限，迫使工业界转向直接芯片液冷（DLC）与浸没式液冷。\n2. 液冷介质热物理效能优势：液体冷却液体积热容约为空气的 3,500 倍，对流换热系数高达 5,000~15,000 W/(m²·K)，微通道冷板换热支持单机架密度达到 150~200 kW，并将数据中心 PUE 降至 1.05~1.15。\n3. 热力学二次约束与系统权衡：热力学第二定律约束下，液冷仅将高密度热流转移至冷却水回路而非消灭热量，排放 35°C~45°C 温水废热面临机械压缩制冷电耗与蒸发冷却塔水资源消耗（WUE 危机）的权衡；同时全球数据中心用电激增与电网承载余量收紧进一步促使行业在散热优化与算法效率、低功耗架构等技术替代轴之间展开探索。",
  "claims": [
    {
      "id": "claim_001",
      "text": "GPU 单芯片功耗随着架构演进显著上升（A100 400W、H100 700W、B200 1,000W），导致传统风冷技术在 40–50 kW/机架处达到物理散热极限并失效。",
      "epistemic_state": "supported",
      "evidence_refs": [
        "GPU产业技术源流与投资机会_最终报告:ch5-2:0024"
      ],
      "rationale": "证据直接陈述 GPU TDP 从 A100 400W 逐步增至 B200 1,000W，且风冷在 40–50 kW/机架失效。"
    },
    {
      "id": "claim_002",
      "text": "微通道冷板换热技术能够使数据中心承受高达 150 kW~200 kW 的单机架功率密度，并将 PUE 压制在 1.05~1.15 的极优区间，液体冷却液（去离子水/乙二醇溶液）的体积热容约为空气的 3,500 倍，对流换热系数高达 5,000~15,000 W/(m²·K)。",
      "epistemic_state": "supported",
      "evidence_refs": [
        "M06:ch1-2:o2:0008"
      ],
      "rationale": "证据直接陈述液体冷却液热物理参数及冷板换热支持 150~200 kW 机架密度和 1.05~1.15 PUE。"
    },
    {
      "id": "claim_003",
      "text": "浸没式液冷技术将整台服务器主板、CPU、GPU、内存及供电模块完全浸泡在不导电的绝缘介电液体（Dielectric Fluid）中进行热交换。",
      "epistemic_state": "supported",
      "evidence_refs": [
        "M07:ch4-1:0039"
      ],
      "rationale": "证据直接陈述浸没式液冷的技术定义与浸泡组件范围。"
    },
    {
      "id": "claim_004",
      "text": "冷却系统并未消灭热量，而是将高密度的热流转移至冷却水回路中；为了将 35°C~45°C 的温水废热排放至大气，采用机械制冷压缩机（Chiller）将消耗巨大压缩电能，采用蒸发冷却塔则引发水资源消耗硬约束（WUE 危机）。",
      "epistemic_state": "supported",
      "evidence_refs": [
        "M06:ch1-2:o2:0008"
      ],
      "rationale": "证据直接陈述热力学第二定律下废热转移及机械制冷电耗与蒸发冷却水耗约束。"
    },
    {
      "id": "claim_005",
      "text": "AI 算力扩张推升液冷需求的核心因果机制为：大算力芯片高 TDP 与高密度集群使得机架发热功率突破风冷散热极限（40–50 kW/机架），液冷凭借高体积热容与传热效率成为承载 150~200 kW 单机架密度与压降 PUE 的必由技术路线，驱动工业界向直接芯片液冷（DLC）与浸没式液冷全面迁移。",
      "epistemic_state": "inference",
      "evidence_refs": [
        "GPU产业技术源流与投资机会_最终报告:ch5-2:0024",
        "M06:ch1-2:o2:0008"
      ],
      "rationale": "由 GPU 功耗演进、风冷失效界限与冷板热力学性能共同推导出的系统因果机制。"
    },
    {
      "id": "claim_006",
      "text": "行业报告预估下一代 Rubin GPU 单芯片 TDP 约达 1,800W+，液冷渗透率在 2024 年为 14%、2025 年为 33%。",
      "epistemic_state": "uncertain",
      "evidence_refs": [
        "GPU产业技术源流与投资机会_最终报告:ch5-2:0024"
      ],
      "rationale": "包含未来芯片功耗预估（约 1,800W+）与市场渗透率统计，按规约标为 uncertain 并保留限定词。"
    },
    {
      "id": "claim_007",
      "text": "IEA (2025/2026) 预测全球数据中心用电 2024 年 415 TWh（占全球 1.5%）增至 2025 年 485 TWh（+17%），预计 2030 年达约 950 TWh（约 3%）；SemiAnalysis Energy 预计美国电网可承载新增负荷余量将于 2027 年转负，2030 年数据中心需求 84 GW 对比电网年增 15 GW，变压器交期为 3–4 年。",
      "epistemic_state": "uncertain",
      "evidence_refs": [
        "GPU产业技术源流与投资机会_最终报告:ch5-2:0024"
      ],
      "rationale": "包含机构对 2027 年与 2030 年未来年份的前瞻性预测与情景估算，标为 uncertain。"
    },
    {
      "id": "claim_008",
      "text": "面对电力与变压器交付瓶颈，行业存在通过算法效率（蒸馏/小模型）、SMR 核电与低功耗架构等技术替代轴打破增长物理上限的潜在演进路径。",
      "epistemic_state": "inference",
      "evidence_refs": [
        "GPU产业技术源流与投资机会_最终报告:ch5-2:0024"
      ],
      "rationale": "基于历史技术替代类比与报告对电力交付约束应对替代轴的论述推导得出。"
    }
  ],
  "tensions": [
    {
      "id": "tension_001",
      "text": "机架内部高换热效能与末端废热外排二次消耗之间的热力学张力：液冷将机架 PUE 压制在 1.05~1.15 并支持 150~200 kW 超高密度，但热力学第二定律使得高密度热流转移至冷却水回路后，排放 35°C~45°C 温水废热面临机械压缩制冷高电耗 vs 蒸发冷却塔 WUE 危机（水资源剧烈消耗）的二难选择。",
      "evidence_refs": [
        "M06:ch1-2:o2:0008"
      ]
    },
    {
      "id": "tension_002",
      "text": "算力电力硬约束（电网负荷余量预计 2027 年转负、变压器交期 3–4 年）的绝对上限叙事，与通过算法蒸馏/小模型、SMR 核电和低功耗架构等技术替代轴突破增长极限叙事之间的张力。",
      "evidence_refs": [
        "GPU产业技术源流与投资机会_最终报告:ch5-2:0024"
      ]
    }
  ],
  "uncertainties": [
    "机构对 2027 年美国电网可承载余量转负、2030 年数据中心用电约 950 TWh 及下一代芯片功耗约 1,800W+ 等未来预测指标存在宏观与技术落地不确定性。",
    "高密液冷智算中心在 35°C~45°C 温水废热排放中，机械压缩制冷电能消耗与蒸发冷却塔水资源消耗（WUE 危机）的综合平衡路径具有不确定性。",
    "算法效率优化（模型蒸馏、轻量化）及新型低功耗架构对延缓算力中心电网与散热硬约束的实际贡献幅度存在不确定性。"
  ],
  "open_questions": [
    "在单机架功率密度跨越 150 kW~200 kW 向更高密度演进过程中，DLC（冷板式）与浸没式液冷在全生命周期维护成本与可靠性上的分化临界点为何？",
    "针对温水废热排放面临的 WUE 水资源危机，无水冷却技术或工业废热回收方案在大规模 AI 智算中心中是否具备经济可行性？"
  ],
  "additional_evidence_needed": [
    {
      "question": "DLC 冷板液冷与单相/两相浸没式液冷在大规模万卡集群生产环境中的实际失效率、冷液泄露率与长期维护改造成本数据。",
      "reason": "当前证据仅提供微通道冷板传热微分方程与浸没式绝缘介电液体原理，缺乏工程实践中大规模运维与可靠性量化数据。"
    },
    {
      "question": "不同气候分区与冷却架构（干冷器、闭式冷却塔、机械制冷）下排放 35°C~45°C 低品位废热的全年实测 PUE 与 WUE 联动平衡数据。",
      "reason": "证据指出了热力学第二定律下废热外排带来的电能消耗与 WUE 危机，但缺少不同排热工程工艺的定量实测指标对比。"
    }
  ],
  "worker": {
    "tool": "antigravity",
    "model": "gemini-2.5-pro"
  },
  "generated_at": "2026-08-30T19:04:30+08:00"
}