{
  "schema_version": "1.0",
  "task_id": "20260830_180538_task",
  "task_type": "tension_extraction",
  "query": "数据中心用电强增长与液冷能效提升两条证据方向是否相互矛盾？",
  "summary": "两条证据方向并不构成直接矛盾，而是并行约束：用电总量强增长（2024→2025 +17%、2030 预测约 950 TWh、GPU TDP 攀升）与液冷能效提升（单机架 150–200 kW、PUE 1.05–1.15）同向并存；但证据同时指出液冷并未消灭热量，只是把废热转移至冷却水回路，机械制冷耗电、蒸发冷却塔耗水，存在次级能效-资源张力。",
  "claims": [
    {
      "id": "claim_001",
      "text": "全球数据中心用电量按 IEA 口径为 2024 年 415 TWh（占全球 1.5%）→ 2025 年 485 TWh（同比 +17%）。（【A，IEA 2025/2026】口径）",
      "epistemic_state": "supported",
      "evidence_refs": ["GPU产业技术源流与投资机会_最终报告:ch5-2:0024"]
    },
    {
      "id": "claim_002",
      "text": "预测 2030 年全球数据中心用电约 950 TWh（约占全球 3%，保留“约”与预测口径）。",
      "epistemic_state": "uncertain",
      "evidence_refs": ["GPU产业技术源流与投资机会_最终报告:ch5-2:0024"],
      "rationale": "未来年份预测且含“约”，标 uncertain。"
    },
    {
      "id": "claim_003",
      "text": "美电网可承载新增负荷余量预计 2027 年转负；数据中心需求约 84 GW（2030）对比电网年增约 15 GW；大型变压器交期 3–4 年（【B，SemiAnalysis Energy】口径）。",
      "epistemic_state": "uncertain",
      "evidence_refs": ["GPU产业技术源流与投资机会_最终报告:ch5-2:0024"],
      "rationale": "含“预计/约”与机构预测口径，标 uncertain。"
    },
    {
      "id": "claim_004",
      "text": "GPU TDP 逐代上升：A100 400W → H100 700W → B200 1,000W。",
      "epistemic_state": "supported",
      "evidence_refs": ["GPU产业技术源流与投资机会_最终报告:ch5-2:0024"]
    },
    {
      "id": "claim_005",
      "text": "后续 Rubin 的 TDP 标注约 1,800W+（保留“约”口径）。",
      "epistemic_state": "uncertain",
      "evidence_refs": ["GPU产业技术源流与投资机会_最终报告:ch5-2:0024"],
      "rationale": "原文含“约”，标 uncertain。"
    },
    {
      "id": "claim_006",
      "text": "风冷 40–50 kW/机架失效；液冷渗透率 14%（2024）→33%（2025）（渗透率为估算口径，保留原文）。",
      "epistemic_state": "uncertain",
      "evidence_refs": ["GPU产业技术源流与投资机会_最终报告:ch5-2:0024"],
      "rationale": "“渗透率”属规定不得标 supported 的口径，保留限定词。"
    },
    {
      "id": "claim_007",
      "text": "液体冷却液（去离子水/乙二醇溶液）的体积热容约为空气的 3,500 倍，对流换热系数约 5,000–15,000 W/(m²·K)。",
      "epistemic_state": "uncertain",
      "evidence_refs": ["M06:ch1-2:o2:0008"],
      "rationale": "原文含“约”，为典型值口径，保留限定词标 uncertain。"
    },
    {
      "id": "claim_008",
      "text": "冷板换热使数据中心能够承受高达 150 kW–200 kW 的单机架密度，并将 PUE 压制在 1.05–1.15 的区间。",
      "epistemic_state": "supported",
      "evidence_refs": ["M06:ch1-2:o2:0008"]
    },
    {
      "id": "claim_009",
      "text": "冷却系统并未消灭热量，只是将高密度热流转移至冷却水回路（热力学第二定律）；若采用机械制冷压缩机将消耗巨大压缩电能，若采用蒸发冷却塔则引发惊人的水资源消耗硬约束（WUE 危机）。",
      "epistemic_state": "supported",
      "evidence_refs": ["M06:ch1-2:o2:0008"]
    }
  ],
  "tensions": [
    {
      "id": "tension_001",
      "text": "用电总量强增长与单位能效改善构成方向性对照而非矛盾：全球数据中心用电 2024→2025 增 17%、2030 预测约 950 TWh、GPU TDP 逐代攀升，与液冷将单机架密度提升至 150–200 kW、PUE 压至 1.05–1.15 并存——总量上行与能效提升在各自身维度上同时成立。",
      "evidence_refs": ["GPU产业技术源流与投资机会_最终报告:ch5-2:0024", "M06:ch1-2:o2:0008"]
    },
    {
      "id": "tension_002",
      "text": "能效改善的次级代价构成了内部张力：液冷提升机架密度与 PUE 的同时并未消灭热量，只是把废热转移至冷却水回路——机械制冷压缩机会消耗巨大压缩电能，蒸发冷却塔会引发 WUE 水资源危机，即冷却能效改善与冷却系统自身能耗/耗水之间存在权衡。",
      "evidence_refs": ["M06:ch1-2:o2:0008"]
    },
    {
      "id": "tension_003",
      "text": "能源刚性与替代弹性之间的张力：证据给出用电预测持续上行（2030 约 950 TWh、电网余量 2027 年预计转负），同时又以 1973 石油危机被反复突破作类比，称电力是短期交付约束、“绝对上限”叙事本身是行业话语、算法效率/SMR/低功耗架构为替代轴——刚性增长叙事与替代弹性叙事并存。",
      "evidence_refs": ["GPU产业技术源流与投资机会_最终报告:ch5-2:0024"]
    }
  ],
  "uncertainties": [
    "用电量（2030 约 950 TWh、约 84 GW）与电网余量转负时间（2027 年）为机构预测口径（IEA、SemiAnalysis）。",
    "液冷渗透率与增长率（+17%）为估算口径。",
    "体积热容倍数与换热系数为含“约”的典型值。",
    "证据未提供液冷能效提升与用电总量增长之间的联合抵消测算，两条方向的关系为推断解释。"
  ],
  "open_questions": [
    "液冷渗透率提升能否在总量层面抵消数据中心用电增长？",
    "蒸发冷却塔（WUE 危机）与机械制冷的额外能耗在典型机组的量级是多少？"
  ],
  "additional_evidence_needed": [
    {
      "question": "液冷渗透率提升与数据中心总用电量增长之间的联合量化测算是什么？",
      "reason": "证据分别陈述两个方向，未给出两者抵消关系的量化分析，无法判定是否矛盾。"
    },
    {
      "question": "机械制冷与蒸发冷却塔在典型数据中心的额外电耗与耗水量数据是什么？",
      "reason": "证据仅定性说明“巨大压缩电能”与“惊人水资源消耗”，无量化数据。"
    }
  ],
  "worker": {
    "tool": "codex-external",
    "model": "claude-sonnet-4"
  },
  "generated_at": "2026-08-30T23:10:23+08:00"
}