{
  "schema_version": "1.0",
  "task_id": "20260830_180537_task",
  "task_type": "comparison",
  "query": "比较四轮价值链中租金归属与集中度的差异。",
  "claims": [
    {
      "id": "claim_001",
      "text": "第一阶段（底层硬件与核心设备制造商暴利）：在技术爆发初期，底层动力供给存在极高的工程物理壁垒与产能稀缺性；瓦特与博尔顿的蒸汽机厂、爱迪生与通用电气的发电设备部门、英特尔的 CPU、当前英伟达的 GPU 与台积电的 CoWoS 先进封装，享有高达 60%~80% 的垄断毛利率与整个产业链绝大部分的经济利润。",
      "epistemic_state": "supported",
      "evidence_refs": ["M01:ch5-3:0062"],
      "rationale": "证据（EV001）第 1 点直接陈述，照原文数值与限定词转述。"
    },
    {
      "id": "claim_002",
      "text": "第二阶段主体行为（融资与资本开支）：铁路公司、电网公用事业、电信运营商与当前的超大规模云厂商（Hyperscalers），为争夺未来的通道霸权，进行了规模空前的债务或股权融资，并进行过度资本开支（Over-Capex）。",
      "epistemic_state": "supported",
      "evidence_refs": ["M01:ch5-3:0062"],
      "rationale": "证据（EV001）第 2 点直接陈述的行为事实部分，不含后果判断。"
    },
    {
      "id": "claim_003",
      "text": "报告据历史阶段模式推断：第二阶段若企业为争夺未来通道霸权持续过度资本开支，可能引发严重的\u201c暗光纤（Dark Fiber）\u201d/\u201c暗算力（Dark Compute）\u201d过剩与资本回报率（ROIC）下挫；该判断是报告基于阶段模式的推断（证据原文表述为\u201c必然引发\u201d），而非已观测的直接后果，故按条件式转述，不用\u201c必然\u201d。",
      "epistemic_state": "inference",
      "evidence_refs": ["M01:ch5-3:0062"],
      "rationale": "按 R2-2 规则 4.2 拆分：融资/资本开支属直接事实（见 claim_002，supported）；\u201c必然引发过剩与 ROIC 下挫\u201d为强因果且无直接观测，仅可标 inference，措辞用\u201c若……可能引发\u201d的条件式表述。"
    },
    {
      "id": "claim_004",
      "text": "报告在 [L1] 归因下作出阶段模式外推：当底层算力与能源由于过度竞争降为极低成本公用事业品后，价值捕获中枢可能向直接掌控终端用户、重塑垂直行业工作流、并将 AI 深度嵌入组织微观肌理的平台型与生态型企业漂移（证据原文表述为\u201c不可逆地漂移\u201d）；此为对未来价值迁移的判断，\u201c不可逆\u201d程度无法由当前证据验证，[L1 因果证实] 不构成可直接观测的支撑依据。",
      "epistemic_state": "inference",
      "evidence_refs": ["M01:ch5-3:0062"],
      "rationale": "按 R2-2 规则 4.2 拆分：价值迁移是对未来的判断且含\u201c不可逆\u201d强因果，不得 supported；保留条件（\u201c当底层算力与能源……后\u201d）与 [L1] 归因口径。"
    },
    {
      "id": "claim_005",
      "text": "四轮价值链租金归属历史事实：铁路时代租金归于轨道/路权所有者；电气时代归于电气设备商（通用电气、西屋）；平台时代归于流量入口；AI 时代租金高度集中于三层栈的顶端与瓶颈。",
      "epistemic_state": "supported",
      "evidence_refs": ["四次技术革命比较解剖_最终报告:ch2:o22:0028"],
      "rationale": "证据（EV002）直接陈述四轮租金归属主体与 AI 时代租金集中位置。"
    },
    {
      "id": "claim_006",
      "text": "Nvidia 财报披露事实：Nvidia 2027 财年第一季度营收达 816 亿美元、数据中心收入 752 亿美元（同比 +92%），创纪录（Nvidia, 2026）。\u201c2027 财年\u201d为会计年度标签，属已披露财报数据而非未来预测。",
      "epistemic_state": "supported",
      "evidence_refs": ["四次技术革命比较解剖_最终报告:ch2:o22:0028"],
      "rationale": "按 R2-2 规则 4.2 第 4 点：已披露财报数据可直接转述，不得写成未来预测。"
    },
    {
      "id": "claim_007",
      "text": "AI 时代集中度的第三方份额估算（约）：Nvidia 占 AI 加速器（GPU）收入约 80%（OECD, 2025, AI 基础设施竞争; Stanford HAI AI Index, 2026）；TSMC 占晶圆代工约 72% 且是 CoWoS 先进封装瓶颈（BIS, 2026; Stanford HAI）；SK Hynix 占 HBM 约 50%\u201355%（Stanford HAI; BIS）——均为第三方研究估算，保留\u201c约\u201d与来源标注。",
      "epistemic_state": "uncertain",
      "evidence_refs": ["四次技术革命比较解剖_最终报告:ch2:o22:0028"],
      "rationale": "按 R2-2 规则 4.2 第 3 点：带数字的市场份额估算不得标 supported，保留\u201c约\u201d\u201c据…估计\u201d及来源口径。"
    },
    {
      "id": "claim_008",
      "text": "平台时代集中度的第三方研究估算：据 OECD 等对数字市场竞争的研究，头部平台在多国市场长期占据压倒性份额，其 2025 年对波兰、拉脱维亚、立陶宛在线集市的研究显示单一平台流量份额可达 80% 以上（OECD, 2025, 在线集市竞争研究）——为第三方研究估算，保留\u201c可达\u201d与来源标注。",
      "epistemic_state": "uncertain",
      "evidence_refs": ["四次技术革命比较解剖_最终报告:ch2:o22:0028"],
      "rationale": "按 R2-2 规则 4.2 第 3 点：平台流量份额估算不得标 supported，保留\u201c可达\u201d与来源。"
    },
    {
      "id": "claim_009",
      "text": "AI 时代集中度结构：少数超大规模云厂同时掌握需求入口与资本开支，形成\u201c模型\u2014算力\u2014云\u201d的纵向租金漏斗。",
      "epistemic_state": "supported",
      "evidence_refs": ["四次技术革命比较解剖_最终报告:ch2:o22:0028"],
      "rationale": "证据（EV002）直接陈述，结构性描述照原文转述。"
    },
    {
      "id": "claim_010",
      "text": "报告将 AI 产业组织归纳为\u201c模型实验室 + 算力云 + AI 原生应用\u201d三层结构，该划分与 OECD（2025）对 AI 基础设施\u201c多层级栈、持续集中、垂直整合\u201d的描述及 BIS（2026）对 AI 栈的分层判断一致（报告直接陈述，OECD, 2025, AI 基础设施竞争）。",
      "epistemic_state": "supported",
      "evidence_refs": ["四次技术革命比较解剖_最终报告:ch2:o22:0028"],
      "rationale": "按 R2-2 规则 4.2 第 5 点：报告直接陈述的归纳性描述，不作为外部独立事实断言。"
    },
    {
      "id": "claim_011",
      "text": "报告将价值链价值捕获归纳为三阶段迁移模式：第一阶段底层硬件与核心设备制造商暴利，第二阶段网络与基础设施建设者过度投资并陷入资本开支陷阱，第三阶段终端应用与组织流程重构者捕获终局最大价值（对应其第 5.3 节标题\u201c价值捕获的终局迁移：从底层动力设备制造向网络分发与终端重构者流动\u201d）；此为报告的理论归纳，而非可直接观测的事实。",
      "epistemic_state": "inference",
      "evidence_refs": ["M01:ch5-3:0062"],
      "rationale": "三阶段结构与迁移方向是报告（EV001）的机制归纳，用于回答\u201c比较四轮价值链\u201d的差异框架，标 inference 并保留报告归因。"
    }
  ],
  "tensions": [
    {
      "id": "tension_001",
      "text": "第一阶段\u201c底层硬件长期享有高达 60%~80% 垄断毛利率与绝大部分经济利润\u201d及当前集中度证据（Nvidia 占 AI 加速器收入约 80%、TSMC 占晶圆代工约 72%、SK Hynix 占 HBM 约 50%\u201355%）与第三阶段\u201c价值捕获中枢将不可逆漂移向平台型/生态型企业\u201d之间的张力：前者是已观测/报告陈述的当前事实，后者是报告推断的未来价值迁移；证据并未直接解决设备层与平台层谁最终获得终局价值。",
      "epistemic_state": "uncertain",
      "evidence_refs": ["M01:ch5-3:0062", "四次技术革命比较解剖_最终报告:ch2:o22:0028"],
      "rationale": "按 R2-2 规则 4.3：整条张力标 uncertain，因当前事实与未来推断无法在同一证据层面化解。"
    },
    {
      "id": "tension_002",
      "text": "报告阶段模式推断\u201c第二阶段过度资本开支可能引发暗光纤/暗算力过剩与 ROIC 下挫\u201d与\u201c当前超大规模云厂高资本开支的同时 Nvidia 财报高增长（2027 财年 Q1 营收 816 亿美元、数据中心收入同比 +92%）\u201d之间的张力：报告模式判断与当前观测未在证据中被化解。",
      "epistemic_state": "uncertain",
      "evidence_refs": ["M01:ch5-3:0062", "四次技术革命比较解剖_最终报告:ch2:o22:0028"],
      "rationale": "按 R2-2 规则 4.3：模式判断与高增长观测并存，缺乏中介证据，标 uncertain。"
    }
  ],
  "uncertainties": [
    "第二阶段\u201c必然引发暗光纤/暗算力过剩与 ROIC 下挫\u201d依赖\u201c企业为争夺通道霸权持续过度资本开支\u201d的前提，且缺少对超大规模云厂实际资本开支后果与回报率的直接观测数据。",
    "\u201c价值捕获中枢不可逆漂移向平台型/生态型企业\u201d的\u201c不可逆\u201d程度无法由当前证据验证：依据仅为报告在 [L1] 归因下的阶段模式外推，无跨时期价值分配的直接观测。",
    "集中度份额（Nvidia 约 80%、TSMC 约 72%、SK Hynix 约 50%\u201355%、平台单一流量份额可达 80% 以上）均为第三方研究（OECD 2025、Stanford HAI AI Index 2026、BIS 2026）的估算，依赖其统计时点、市场口径与估计方法。"
  ],
  "open_questions": [
    "第一阶段底层硬件厂商的垄断毛利率（60%~80%）在什么条件下、以何种速率向第三阶段平台层迁移，证据未提供时点与路径。",
    "当前超大规模云厂的高资本开支是否确实导致暗光纤/暗算力过剩、ROIC 是否已下挫，证据中没有独立观测数据，仅有报告的阶段模式推断。",
    "平台时代的流量份额（在线集市市场）与 AI 时代的加速器/晶圆代工/HBM 份额来自不同研究、不同市场与口径，四轮集中度是否可直接横向比较。"
  ],
  "additional_evidence_needed": [
    {
      "question": "第二阶段过度资本开支后，暗光纤/暗算力过剩与 ROIC 下挫是否有实际部署或财务数据可观测？",
      "reason": "证据仅含报告的阶段模式推断与 [L1] 归因，缺乏对超额资本开支后果的直接观测数据。"
    },
    {
      "question": "价值捕获中枢向平台型/生态型企业漂移是否以及何种程度上不可逆？",
      "reason": "\u201c不可逆\u201d属强因果表述，当前证据无法验证其程度，需要跨时期的价值分配与利润份额数据。"
    },
    {
      "question": "集中度份额（Nvidia 约 80%、TSMC 约 72%、SK Hynix 约 50%\u201355%、平台流量份额可达 80% 以上）的统计时点与口径是否可比？",
      "reason": "估算来自 OECD 2025、Stanford HAI AI Index 2026、BIS 2026 等第三方研究，覆盖不同市场与不同统计口径。"
    }
  ],
  "worker": {
    "tool": "codex-external",
    "provider": "external",
    "model": null
  },
  "generated_at": "2026-08-31T11:10:00+08:00"
}