{
  "schema_version": "1.0",
  "task_id": "20260830_180538_task",
  "task_type": "tension_extraction",
  "query": "价值捕获终局在底层设备与网络分发之间是否存在证据张力？",
  "claims": [
    {
      "id": "claim_001",
      "text": "第一阶段（技术爆发初期），底层动力供给存在极高的工程物理壁垒与产能稀缺性：瓦特与博尔顿的蒸汽机厂、爱迪生与通用电气的发电设备部门、英特尔的 CPU、当前英伟达的 GPU 与台积电的 CoWoS 先进封装，享有高达 60%~80% 的垄断毛利率与整个产业链绝大部分的经济利润。",
      "epistemic_state": "supported",
      "evidence_refs": ["M01:ch5-3:0062"],
      "rationale": "证据原文直接陈述的第一阶段结构性事实，照原文口径转述垄断毛利率区间与利润分布。"
    },
    {
      "id": "claim_002",
      "text": "第二阶段的主体行为是：铁路公司、电网公用事业、电信运营商与当前的超大规模云厂商（Hyperscalers），为争夺未来的通道霸权，进行规模空前的债务或股权融资、进行过度资本开支（Over-Capex）。",
      "epistemic_state": "supported",
      "evidence_refs": ["M01:ch5-3:0062"],
      "rationale": "融资与资本开支是证据原文直接陈述的主体行为事实，可照原文口径转述。"
    },
    {
      "id": "claim_003",
      "text": "在第二阶段因争夺通道霸权而过度资本开支的前提下，报告据此判断可能引发严重的暗光纤（Dark Fiber）/暗算力（Dark Compute）过剩与资本回报率（ROIC）下挫；这是报告按历史阶段模式作出的推断，而非已观测到的确定后果。",
      "epistemic_state": "inference",
      "evidence_refs": ["M01:ch5-3:0062"],
      "rationale": "证据原文使用\"必然引发\"表述，属强因果；拆分后融资/资本开支为直接事实（见 claim_002），过剩与 ROIC 下挫改写为条件式推断（在…前提下/报告据此判断可能引发），不沿用\"必然\"措辞。"
    },
    {
      "id": "claim_004",
      "text": "报告（[L1] 归因）推断：当底层算力与能源因过度竞争降为极低成本的公用事业品后，价值捕获中枢将（被描述为\"不可逆地\"）漂移向直接掌控终端用户、重塑垂直行业工作流并将 AI 深度嵌入组织微观肌理的平台型与生态型企业；该判断是对未来价值的阶段模式外推，其\"不可逆\"程度无法由当前证据验证。",
      "epistemic_state": "inference",
      "evidence_refs": ["M01:ch5-3:0062"],
      "rationale": "价值迁移是对未来后果的判断且含\"不可逆\"强因果，不得标 supported；保留条件前提与 [L1] 归因口径，明确\"不可逆\"程度不可验证，不把 [L1 因果证实] 作为 supported 依据。"
    },
    {
      "id": "claim_005",
      "text": "四轮价值链租金归属的历史事实：铁路时代租金归于轨道/路权所有者；电气时代归于电气设备商（通用电气、西屋）；平台时代归于流量入口；AI 时代租金高度集中于三层栈的顶端与瓶颈。",
      "epistemic_state": "supported",
      "evidence_refs": ["四次技术革命比较解剖_最终报告:ch2:o22:0028"],
      "rationale": "证据原文直接陈述的租金归属历史事实，照原文口径转述。"
    },
    {
      "id": "claim_006",
      "text": "Nvidia 财报事实：2027 财年第一季度营收达 816 亿美元、数据中心收入 752 亿美元（同比 +92%），创纪录（Nvidia, 2026）；其中\"2027 财年\"为会计年度标签，属已披露财报数据而非未来预测。",
      "epistemic_state": "supported",
      "evidence_refs": ["四次技术革命比较解剖_最终报告:ch2:o22:0028"],
      "rationale": "已披露财报数字可直接转述 supported；注明会计年度标签口径，避免被读作未来年份预测。"
    },
    {
      "id": "claim_007",
      "text": "少数超大规模云厂同时掌握需求入口与资本开支，形成\"模型—算力—云\"的纵向租金漏斗；报告将 AI 产业组织归纳为\"模型实验室 + 算力云 + AI 原生应用\"三层结构，该划分与 OECD（2025）对 AI 基础设施\"多层级栈、持续集中、垂直整合\"的描述及 BIS（2026）对 AI 栈的分层判断一致。",
      "epistemic_state": "supported",
      "evidence_refs": ["四次技术革命比较解剖_最终报告:ch2:o22:0028"],
      "rationale": "证据原文直接陈述的当前产业组织结构性描述及其与 OECD/BIS 的一致性，属事实性归纳（报告直接陈述）。"
    },
    {
      "id": "claim_008",
      "text": "就集中度而言，据第三方研究估计，Nvidia 占 AI 加速器（GPU）收入约 80%（OECD, 2025, AI 基础设施竞争; Stanford HAI AI Index, 2026）。",
      "epistemic_state": "uncertain",
      "evidence_refs": ["四次技术革命比较解剖_最终报告:ch2:o22:0028"],
      "rationale": "市场份额估算为第三方研究数据，保留\"约\"与来源口径，不得标 supported。"
    },
    {
      "id": "claim_009",
      "text": "据第三方研究估计，TSMC 占晶圆代工约 72%，且为 CoWoS 先进封装瓶颈（BIS, 2026; Stanford HAI）。",
      "epistemic_state": "uncertain",
      "evidence_refs": ["四次技术革命比较解剖_最终报告:ch2:o22:0028"],
      "rationale": "份额估算为第三方研究数据，保留\"约\"与来源口径。"
    },
    {
      "id": "claim_010",
      "text": "据第三方研究估计，SK Hynix 占 HBM 约 50%–55%（Stanford HAI; BIS）。",
      "epistemic_state": "uncertain",
      "evidence_refs": ["四次技术革命比较解剖_最终报告:ch2:o22:0028"],
      "rationale": "份额估算为第三方研究数据，保留区间与来源口径。"
    },
    {
      "id": "claim_011",
      "text": "平台时代头部平台在多国市场长期占据压倒性份额，例如 OECD（2025）对波兰、拉脱维亚、立陶宛在线集市的研究显示单一平台流量份额可达 80% 以上；属第三方研究估算。",
      "epistemic_state": "uncertain",
      "evidence_refs": ["四次技术革命比较解剖_最终报告:ch2:o22:0028"],
      "rationale": "单一平台流量份额\"可达 80% 以上\"为第三方研究估算，保留\"可达\"与来源口径。"
    },
    {
      "id": "claim_012",
      "text": "针对查询\"价值捕获终局在底层设备与网络分发之间是否存在证据张力\"：证据同时呈现\"第一阶段/当前底层设备高度集中并享有大部分经济利润\"（已观测事实与份额估算）与\"报告推断价值捕获中枢未来将向平台型/生态型企业漂移\"（对未来迁移的判断）；证据并未直接解决设备层与平台层/网络分发层谁最终获得终局价值，张力在证据层面尚未化解。",
      "epistemic_state": "uncertain",
      "evidence_refs": ["M01:ch5-3:0062", "四次技术革命比较解剖_最终报告:ch2:o22:0028"],
      "rationale": "对两类证据之间张力关系的综合判断：终局归属无法由当前证据确定，标 uncertain。"
    }
  ],
  "tensions": [
    {
      "id": "tension_001",
      "text": "第一阶段底层硬件长期享有 60%~80% 垄断毛利率与绝大部分经济利润、当前集中度证据（Nvidia 占 AI 加速器收入约 80%、TSMC 占晶圆代工约 72% 且为 CoWoS 瓶颈、SK Hynix 占 HBM 约 50%–55%）与报告推断\"价值捕获中枢将不可逆地漂移向平台型/生态型企业\"之间的张力：前者是已观测的当前事实与第三方份额估算，后者是报告对未来迁移的阶段模式推断；证据并未直接解决设备层与平台层/网络分发层谁最终获得终局价值，设备层当前的垄断利润是否及何时被侵蚀无法由证据确定。",
      "evidence_refs": ["M01:ch5-3:0062", "四次技术革命比较解剖_最终报告:ch2:o22:0028"],
      "epistemic_state": "uncertain",
      "rationale": "张力两端证据强度不同（已观测事实/估算 vs 未来推断）且未在证据中化解，整条张力标 uncertain。"
    },
    {
      "id": "tension_002",
      "text": "报告对第二阶段的模式判断\"过度资本开支可能引发暗光纤/暗算力过剩与 ROIC 下挫\"，与当前观测\"超大规模云厂高资本开支的同时，Nvidia 财报高增长（2027 财年第一季度数据中心收入同比 +92% 创纪录）\"之间的张力：报告的模式判断（对未来后果的推断）与当前观测数据（高资本开支伴随设备商高增长）未在证据中化解。",
      "evidence_refs": ["M01:ch5-3:0062", "四次技术革命比较解剖_最终报告:ch2:o22:0028"],
      "epistemic_state": "uncertain",
      "rationale": "报告阶段模式判断与当前观测是否矛盾或相容，证据未提供直接对比与化解，标 uncertain。"
    }
  ],
  "uncertainties": [
    "暗光纤/暗算力过剩与 ROIC 下挫是对第二阶段过度资本开支未来后果的阶段模式推断，证据中缺少对实际部署量、利用率或资本回报率的直接观测。",
    "\"不可逆漂移\"中的不可逆程度无法由当前证据验证；价值捕获中枢向平台型/生态型企业迁移的时间框架与量化路径未在证据中给出。",
    "市场份额估算（Nvidia 约 80%、TSMC 约 72%、SK Hynix 约 50%–55%、单一平台流量份额可达 80% 以上）依赖第三方研究（OECD 2025、BIS 2026、Stanford HAI AI Index 2026）的时点、口径与方法。",
    "证据未直接回答底层设备（Nvidia、TSMC、SK Hynix 等）与网络分发/平台层之间谁最终获得终局价值，\"网络分发\"在 AI 时代对应的具体实体边界未明确定义。"
  ],
  "open_questions": [
    "设备层当前的垄断利润（第一/当前阶段）是否会在第三阶段被平台型/生态型企业侵蚀？若会，时间框架与传导机制是什么？",
    "超大规模云厂商当前的高资本开支是否确实导致暗算力/暗光纤过剩？当前财报高增长与报告阶段模式判断如何调和？",
    "\"底层设备\"与\"网络分发\"在 AI 时代的边界与对应实体（芯片/封装/内存 vs 云厂商/平台/生态企业）如何界定，进而评价价值归属？"
  ],
  "additional_evidence_needed": [
    {
      "question": "是否有对实际算力/网络部署量与利用率（如数据中心使用率、暗算力/Dark Compute 规模）的直接观测数据？",
      "reason": "用于验证\"过度资本开支引发暗算力过剩\"是否实际发生，当前证据仅有阶段模式推断，无观测数据。"
    },
    {
      "question": "是否存在跨阶段价值捕获迁移的量化证据（如历史时期设备商与平台企业利润/市值的时序对比）？",
      "reason": "用于验证\"不可逆漂移\"的方向与不可逆程度，当前证据无时间序列数据。"
    },
    {
      "question": "设备层（Nvidia/TSMC/SK Hynix）与平台型/生态型企业的价值捕获对比，需要口径一致的第三方份额与利润率数据。",
      "reason": "当前份额估算来自 OECD/BIS/Stanford HAI 等不同时点与口径，且未与平台侧集中度在同一框架下比较。"
    }
  ],
  "worker": {
    "tool": "codex-external",
    "provider": "external",
    "model": null
  },
  "generated_at": "2026-08-31T00:36:18+08:00"
}